{
  "schema_version": "governance_baseline.v1",
  "description": "The canonical governance baseline: the GOV-* guardrails every cloud account and project lives under, and how each cloud enforces them. Defined in 00_UniversalStandards/08_Governance_Guardrails.md; validated by governance_baseline.v1.schema.json. Vendored into consumer repos as .playbook/schemas/governance_baseline.v1.json; Genesis reads it and implements each control per cloud, so the guardrails have one source of truth and cannot drift. mode is each control's target state at the organization root: enforce blocks violations, dry_run only logs them. Genesis stages every new or changed control in dry run first and promotes it to its target only after the dry-run log is clean or every violation has an approved exception, and only once the control has reached adversarially_verified for that cloud. verification records how far each control's proof has got per cloud: specified (the contract states the invariant), schema_validated (passes governance_baseline.v1.schema.json), integration_tested (the real cloud API accepts it and denies the forbidden action in a test project or account), adversarially_verified (every known bypass path, the exception path, and the authorization boundary are tested). Whether a control is actually enforced in an environment is live state that Genesis observes and reports, never a claim in this file. guarantees is the exact invariant the control enforces; does_not_guarantee is what it is often mistaken for. A target changes only through a reviewed change to this file.",
  "parameters": {
    "gcp_allowed_locations": ["in:us-locations"],
    "aws_allowed_regions": ["us-east-1", "us-west-2"],
    "gcp_directory_customer_ids": [],
    "aws_network_admin_role_pattern": "arn:aws:iam::*:role/governance-network-*",
    "hierarchy": ["governance", "platform", "dev", "staging", "prod"]
  },
  "controls": [
    {
      "id": "GOV-001",
      "intent": "No default networks; every network is declared in IaC.",
      "guarantees": "New projects get no auto-created network; in AWS, vended accounts have no default VPC in any region.",
      "does_not_guarantee": "Removing default networks from projects or accounts that existed before the control; those are drift findings to clean up.",
      "sec": null,
      "mode": "enforce",
      "verification": { "gcp": "schema_validated", "aws": "schema_validated" },
      "gcp": { "status": "org_policy", "constraints": [{ "name": "compute.skipDefaultNetworkCreation", "type": "boolean", "enforce": true }] },
      "aws": { "status": "vending", "note": "No SCP can prevent default VPCs; account vending deletes them in every region and drift detection reports any that reappear." }
    },
    {
      "id": "GOV-002",
      "intent": "No long-lived workload keys; workloads use federated, short-lived identity.",
      "guarantees": "No new service account keys can be created or uploaded (GCP); no new IAM user access keys can be created (AWS).",
      "does_not_guarantee": "Revoking keys that already exist (drift findings), or preventing a short-lived credential from being misused while valid.",
      "sec": "SEC-004",
      "mode": "enforce",
      "verification": { "gcp": "schema_validated", "aws": "schema_validated" },
      "gcp": { "status": "org_policy", "constraints": [
        { "name": "iam.disableServiceAccountKeyCreation", "type": "boolean", "enforce": true },
        { "name": "iam.disableServiceAccountKeyUpload", "type": "boolean", "enforce": true }
      ] },
      "aws": { "status": "scp", "statements": [{ "sid": "Gov002DenyAccessKeys", "effect": "Deny", "actions": ["iam:CreateAccessKey"], "resources": ["*"] }] }
    },
    {
      "id": "GOV-003",
      "intent": "No VM is directly reachable from the internet; internet ingress goes through platform-managed load balancers.",
      "guarantees": "VMs cannot hold external IPs (GCP). In AWS: instances cannot request a public IP at launch, Elastic IPs cannot be associated, and only the platform network role can create or attach internet gateways, so a public IP that slips through (e.g. a subnet's map-public-IP default) has no route from the internet.",
      "does_not_guarantee": "That nothing is public: load balancers, serverless endpoints, and managed services can still be exposed and are governed by SEC-003 and service-level controls. It also does not cover exposure through an authorized but over-broad identity.",
      "sec": null,
      "mode": "enforce",
      "verification": { "gcp": "schema_validated", "aws": "schema_validated" },
      "gcp": { "status": "org_policy", "constraints": [{ "name": "compute.vmExternalIpAccess", "type": "list", "deny_all": true }] },
      "aws": { "status": "scp", "note": "The internet-gateway statement carries the guarantee; the launch-time and Elastic IP statements stop the common paths early. The conformance test must cover RunInstances with and without a launch template, CreateNetworkInterface plus AssociateAddress, and a subnet with MapPublicIpOnLaunch.", "statements": [
        { "sid": "Gov003DenyPublicIpAtLaunch", "effect": "Deny", "actions": ["ec2:RunInstances"], "resources": ["arn:aws:ec2:*:*:network-interface/*"], "condition": { "Bool": { "ec2:AssociatePublicIpAddress": "true" } } },
        { "sid": "Gov003DenyElasticIpAssociation", "effect": "Deny", "actions": ["ec2:AssociateAddress"], "resources": ["*"], "condition": { "ArnNotLike": { "aws:PrincipalArn": { "param": "aws_network_admin_role_pattern" } } } },
        { "sid": "Gov003NetworkRoleOwnsInternetGateways", "effect": "Deny", "actions": ["ec2:CreateInternetGateway", "ec2:AttachInternetGateway", "ec2:CreateEgressOnlyInternetGateway"], "resources": ["*"], "condition": { "ArnNotLike": { "aws:PrincipalArn": { "param": "aws_network_admin_role_pattern" } } } }
      ] }
    },
    {
      "id": "GOV-004",
      "intent": "Storage is never public.",
      "guarantees": "Buckets cannot grant access to allUsers or allAuthenticatedUsers (GCP); S3 Block Public Access stays on at the account level (AWS).",
      "does_not_guarantee": "That data is not exposed: an authorized identity with over-broad access, a signed URL, or an export to another system can still leak it. Those are least-privilege (SEC-005) and data-classification concerns.",
      "sec": "SEC-002",
      "mode": "enforce",
      "verification": { "gcp": "schema_validated", "aws": "schema_validated" },
      "gcp": { "status": "org_policy", "constraints": [{ "name": "storage.publicAccessPrevention", "type": "boolean", "enforce": true }] },
      "aws": { "status": "scp", "note": "S3 account-level Block Public Access is set at vending; the SCP stops it being turned off.", "statements": [{ "sid": "Gov004LockPublicAccessBlock", "effect": "Deny", "actions": ["s3:PutAccountPublicAccessBlock"], "resources": ["*"] }] }
    },
    {
      "id": "GOV-005",
      "intent": "Access to storage is IAM-only; no object or bucket ACLs.",
      "guarantees": "New buckets use uniform, IAM-only access (GCP); new S3 buckets have ACLs disabled (AWS).",
      "does_not_guarantee": "That the IAM policy on a bucket is narrow; it makes access reviewable in one place, not minimal.",
      "sec": "SEC-002",
      "mode": "enforce",
      "verification": { "gcp": "schema_validated", "aws": "schema_validated" },
      "gcp": { "status": "org_policy", "constraints": [{ "name": "storage.uniformBucketLevelAccess", "type": "boolean", "enforce": true }] },
      "aws": { "status": "vending", "note": "New buckets default to Object Ownership BucketOwnerEnforced (ACLs disabled); SEC-002 checks it at plan time." }
    },
    {
      "id": "GOV-006",
      "intent": "Resources are created only in approved regions.",
      "guarantees": "Regional resources cannot be created outside the allowed locations or regions.",
      "does_not_guarantee": "Data residency for global services, or for data a workload copies elsewhere itself.",
      "sec": null,
      "mode": "dry_run",
      "verification": { "gcp": "schema_validated", "aws": "schema_validated" },
      "gcp": { "status": "org_policy", "constraints": [{ "name": "gcp.resourceLocations", "type": "list", "allowed_values_param": "gcp_allowed_locations" }] },
      "aws": { "status": "scp", "note": "Global services must stay reachable from every region. Genesis takes the NotAction list from AWS's maintained reference SCP ('Deny access to AWS based on the requested AWS Region', AWS Organizations User Guide) at the version it implements, records that version, and tests it in a test OU before promotion. The list is not hand-maintained here.", "statements": [{
        "sid": "Gov006DenyOtherRegions", "effect": "Deny", "not_actions_source": "aws-reference-scp:deny-requested-region", "resources": ["*"],
        "condition": { "StringNotEquals": { "aws:RequestedRegion": { "param": "aws_allowed_regions" } } }
      }] }
    },
    {
      "id": "GOV-007",
      "intent": "Access is granted only to identities in the platform's own directory.",
      "guarantees": "IAM policies can only name members of the allowed directory (GCP); RAM shares cannot include external principals (AWS).",
      "does_not_guarantee": "Least privilege inside the directory, or that resource policies (e.g. S3 bucket policies) only trust the organization; rig-scan checks aws:PrincipalOrgID at plan time for those.",
      "sec": null,
      "mode": "dry_run",
      "verification": { "gcp": "schema_validated", "aws": "schema_validated" },
      "gcp": { "status": "org_policy", "note": "Needs the organization's directory customer ID; stays dry_run until it is set.", "constraints": [{ "name": "iam.allowedPolicyMemberDomains", "type": "list", "allowed_values_param": "gcp_directory_customer_ids" }] },
      "aws": { "status": "scp", "statements": [{
        "sid": "Gov007DenyExternalSharing", "effect": "Deny", "actions": ["ram:CreateResourceShare", "ram:UpdateResourceShare"], "resources": ["*"],